{
  "schema_version":"kgnote.claim-review-overlay.v1","learning_unit_id":"guided_map_bitepacer_message_delivery","graph_snapshot_sha256":"9fe29c60b397fb78179a7d6c19be747b19b7d4bb1ec634b497f5b7c213046d68","reviewed_at":"2026-09-20T00:00:00+08:00","reviewer":"manual.bitepacer-review.v1",
  "reviews":[
    {"claim_id":"edge_14416de645cb7f873be16c9a19ed021a7f2e61a1b57ac28c08bd49b59be70a23","claim_revision":1,"proposition_sha256":"258009536f037d8f004e4965448311fbcf9373973945c5c74f384e879f32d6d3","source_support":"supported","factual_status":"verified","teaching_answer_status":"ready","reason":"Reviewed fixture evidence supports this teaching claim."},
    {"claim_id":"edge_33c3c2af37bc306d48f90d5bf6616edb6e5dc3de293d6ec52fc315c455613c86","claim_revision":1,"proposition_sha256":"bfa8a4dd62a07c9401d7599eab3ef5c042ac369ddbd6a26650a26aa71ef6ad2f","source_support":"supported","factual_status":"verified","teaching_answer_status":"ready","reason":"Reviewed fixture evidence supports this teaching claim."},
    {"claim_id":"edge_3852d91a3eb001ad73300521137f7cb6f05b16ef6ffe287fdae9afc75c61fea2","claim_revision":1,"proposition_sha256":"39c8622ad4ca0206940a8cc9c72c2b109b3ca863af7e48af1204ff5819a17286","source_support":"supported","factual_status":"verified","teaching_answer_status":"ready","reason":"Reviewed fixture evidence supports this teaching claim."},
    {"claim_id":"edge_6626ad4038e07657f0b204df174eb58ddaee5739914e39dc7e0ec98d36042e97","claim_revision":1,"proposition_sha256":"2552f10328eba685bff4a395357fd5e90a98de8a679e216ffde1c3d9d927dccf","source_support":"supported","factual_status":"verified","teaching_answer_status":"ready","reason":"Reviewed fixture evidence supports this teaching claim."},
    {"claim_id":"edge_80042c4f448d92b2d8311f064b6189e7259615ff1c0babd38bb817adcf561c4a","claim_revision":1,"proposition_sha256":"e4d1af492a394d12cab0479632bb6ea0e975dd2888ef2dedef620c0af70b3a57","source_support":"supported","factual_status":"verified","teaching_answer_status":"ready","reason":"Reviewed fixture evidence supports this teaching claim."},
    {"claim_id":"edge_90a1b92e126e43975b3adcb9e9c54c8cf24d2f7e835784b793decb90435c75c8","claim_revision":1,"proposition_sha256":"0e2a3a1ef0258a2079dfea984fc314f997bf1a91bbbf2dcc2d65efc08e5e5771","source_support":"supported","factual_status":"verified","teaching_answer_status":"ready","reason":"Reviewed fixture evidence supports this teaching claim."},
    {"claim_id":"edge_aad5805e9a5690b8e3eef61e3a75c10ef74e0ecd90acfbfb1ec3d81886674cc3","claim_revision":1,"proposition_sha256":"5f2fb9d24deb2b9d6b31819ed3deaa358216eb5fb1b31d0a5e9d6330ae9bc4bc","source_support":"supported","factual_status":"verified","teaching_answer_status":"ready","reason":"Reviewed fixture evidence supports this teaching claim."}
  ]
}
